{
 "$schema": "https://json-schema.org/draft/2020-12/schema",
 "$id": "https://github.com/CarsonDavis/ocr_translation/2026/scripts/site_schema.json",
 "title": "Site page record",
 "description": "One file of site/data/pages/<id>.json: the layers of one printed page as the viewer reads them. Written by scripts/split_pages.py from manifest.json, transcription/final/<id>.json and (later) the English sections. See docs/site-design.md §4.",
 "type": "object",
 "additionalProperties": false,
 "required": [
  "id",
  "page",
  "folio",
  "side",
  "image",
  "source",
  "running_head",
  "prev",
  "next",
  "english",
  "french",
  "french_notes",
  "uncertain",
  "readings"
 ],
 "properties": {
  "id": {
   "type": "string",
   "minLength": 1,
   "description": "page id, e.g. p004 or p000-title"
  },
  "page": {
   "type": [
    "integer",
    "null"
   ],
   "minimum": 0,
   "description": "true page number; null for the front matter, which is addressed by name"
  },
  "folio": {
   "type": [
    "string",
    "null"
   ],
   "description": "the folio number as printed, which may disagree with `page`"
  },
  "side": {
   "enum": [
    "recto",
    "verso",
    null
   ]
  },
  "image": {
   "type": "string",
   "minLength": 1,
   "description": "image basename; the viewer builds book.images.base + image + book.images.ext"
  },
  "source": {
   "type": "object",
   "additionalProperties": false,
   "required": [
    "kind",
    "image_no",
    "url"
   ],
   "properties": {
    "kind": {
     "enum": [
      "cudl",
      "gallica"
     ]
    },
    "image_no": {
     "type": [
      "integer",
      "null"
     ],
     "description": "scan number in the source viewer; null when the source has no such number"
    },
    "url": {
     "type": "string",
     "minLength": 1
    }
   }
  },
  "running_head": {
   "type": [
    "string",
    "null"
   ]
  },
  "prev": {
   "type": [
    "string",
    "null"
   ]
  },
  "next": {
   "type": [
    "string",
    "null"
   ]
  },
  "english": {
   "type": [
    "array",
    "null"
   ],
   "items": {
    "$ref": "#/$defs/block"
   },
   "description": "null while the translation is pending"
  },
  "french": {
   "type": [
    "array",
    "null"
   ],
   "items": {
    "$ref": "#/$defs/block"
   },
   "description": "null while the transcription is pending"
  },
  "french_notes": {
   "type": [
    "array",
    "null"
   ],
   "items": {
    "$ref": "#/$defs/note"
   },
   "description": "[] when the page has no notes, null when the French layer is pending"
  },
  "uncertain": {
   "type": "array",
   "items": {
    "$ref": "#/$defs/uncertain"
   }
  },
  "readings": {
   "type": "array",
   "description": "contested readings: where the two transcription passes disagreed, decided or still open (split_pages.contested_readings)",
   "items": {
    "$ref": "#/$defs/reading"
   }
  }
 },
 "$defs": {
  "block": {
   "type": "object",
   "additionalProperties": true,
   "required": [
    "type"
   ],
   "properties": {
    "type": {
     "type": "string",
     "minLength": 1
    },
    "text": {
     "type": "string"
    },
    "lines": {
     "type": "array",
     "items": {
      "type": "string"
     }
    },
    "html": {
     "type": "string"
    },
    "notes": {
     "type": "array",
     "items": {
      "$ref": "#/$defs/english_note"
     },
     "description": "sidenotes of an English paragraph, in the order their markers print"
    },
    "continued": {
     "type": "boolean"
    },
    "continues_prev": {
     "type": "boolean"
    },
    "continues_next": {
     "type": "boolean"
    },
    "spaced_caps": {
     "type": "boolean"
    }
   },
   "if": {
    "properties": {
     "type": {
      "const": "paragraph"
     }
    },
    "required": [
     "type"
    ]
   },
   "then": {
    "anyOf": [
     {
      "required": [
       "lines"
      ]
     },
     {
      "required": [
       "html"
      ]
     }
    ]
   }
  },
  "english_note": {
   "type": "object",
   "additionalProperties": false,
   "required": [
    "key",
    "citation",
    "original",
    "gloss"
   ],
   "properties": {
    "key": {
     "type": [
      "string",
      "null"
     ],
     "minLength": 1,
     "description": "the letter printed as the marker, matching the French note key; null for a note the print sets with no key, or a quotation the translator moved into the notes"
    },
    "citation": {
     "type": "string",
     "description": "the citation in English, may contain <i>"
    },
    "original": {
     "type": "string",
     "description": "the citation as Coras printed it"
    },
    "gloss": {
     "type": [
      "string",
      "null"
     ],
     "description": "a sentence of context, or null"
    }
   }
  },
  "note": {
   "type": "object",
   "additionalProperties": false,
   "required": [
    "key",
    "kind",
    "lines"
   ],
   "properties": {
    "key": {
     "type": [
      "string",
      "null"
     ]
    },
    "kind": {
     "enum": [
      "margin",
      "foot"
     ]
    },
    "lines": {
     "type": "array",
     "items": {
      "type": "string"
     }
    }
   }
  },
  "uncertain": {
   "type": "object",
   "additionalProperties": false,
   "required": [
    "where",
    "note"
   ],
   "properties": {
    "where": {
     "type": "string",
     "minLength": 1
    },
    "text": {
     "type": "string"
    },
    "note": {
     "type": "string"
    }
   }
  },
  "reading": {
   "type": "object",
   "additionalProperties": false,
   "required": [
    "where",
    "target",
    "spans",
    "aligned",
    "a",
    "b",
    "text",
    "chose",
    "by",
    "status",
    "reason"
   ],
   "properties": {
    "where": {
     "type": "string",
     "minLength": 1,
     "description": "the final's pointer, as written"
    },
    "target": {
     "type": [
      "string",
      "null"
     ],
     "description": "blocks[i].lines[j], margin_notes[i].lines[j], foot_notes[i].lines[j] or blocks[i].text when the reading sits on one printed line; null for structure (page layout, running head, note keys)"
    },
    "spans": {
     "type": [
      "array",
      "null"
     ],
     "items": {
      "type": "array",
      "items": {
       "type": "integer",
       "minimum": 0
      },
      "minItems": 2,
      "maxItems": 2
     },
     "description": "[start, end) UTF-16 offsets into the target line to underline; null when there is nothing to underline (no target, or readings that agree word for word)"
    },
    "aligned": {
     "type": "boolean",
     "description": "false when the words could not be aligned and the span is the whole line"
    },
    "a": {
     "type": "string",
     "description": "reader A's reading"
    },
    "b": {
     "type": "string",
     "description": "reader B's reading"
    },
    "text": {
     "type": "string",
     "description": "the reading the text carries"
    },
    "chose": {
     "enum": [
      "A",
      "B",
      "neither",
      null
     ],
     "description": "null while open"
    },
    "by": {
     "enum": [
      "carson",
      "reconciler",
      "translator",
      "reviewer",
      "auto",
      null
     ],
     "description": "who decided: carson (the editor), reconciler (the first run's reconciliation model), translator (the translation model, from context), reviewer (the review model, whole-book pass), auto (deferred, open); null for an open arbitration with no decision entry"
    },
    "status": {
     "enum": [
      "decided",
      "open"
     ]
    },
    "reason": {
     "type": [
      "string",
      "null"
     ]
    }
   }
  }
 }
}
