{
 "id": "p039",
 "page": 39,
 "folio": "39",
 "side": "recto",
 "image": "p039",
 "source": {
  "kind": "cudl",
  "image_no": 61,
  "url": "https://cudl.lib.cam.ac.uk/view/PR-MONTAIGNE-00001-00007-00022/61"
 },
 "running_head": "PARLEMINT DE THOLOSE.",
 "prev": "p038",
 "next": "p040",
 "english": [
  {
   "type": "paragraph",
   "html": "approached in these two countries; and at each fact he particularly designates certain persons with whom inquiry can be made (as has since been done, and the whole verified), to render what he said still more persuasive and probable.",
   "continued": true,
   "notes": []
  },
  {
   "type": "heading",
   "text": "ANNOTATION XXI"
  },
  {
   "type": "paragraph",
   "html": "These matters here discoursed at length, and the multitude of so many and so many tokens so true, gave the Judges great occasion to persuade themselves of the innocence of the said du Tilh, and moreover to wonder at the happiness and felicity of his memory, which had known how to recite innumerable things done and past more than twenty years ago; wherein the commissioners, who by all means possible to them strove to catch him in some lie, could nevertheless gain nothing upon him, nor prevent him from answering truly to all things, on which nevertheless he was by them separately and at intervals interrogated. Which drew the judges more and more into wonder, who, for the great felicity of so happy a memory, would gladly have compared him to a Scipio, Cyrus, Theodectes, Mithridates, Themistocles, Cineas, Metrodorus or Lucullus, persons excellent in the gift of memory, and eternally celebrated <sup class=\"mk\" data-key=\"a\">a</sup>, if the wretched end of this prodigious cheat had not offended the splendour of such and so well-marked persons, by comparing to them so impudent, deplorable and wretched a man <sup class=\"mk\" data-key=\"b\">b</sup>. Certainly, if one could without scruple make use of such comparisons, it would be very apt with Porcius Latro, the great companion of Seneca, who boasted that he had never been deceived by his memory in a single word; and, to make trial of it, would often have proposed to him the name of some ancient captain or other illustrious and renowned person, at the pleasure of him who named him, of whom on the spot he would recite from top to bottom the pure truth of all the deeds since his",
   "continued": false,
   "notes": [
    {
     "key": "a",
     "citation": "Cicero, <i>Tusculan Disputations</i> I (I.24.59); <i>De oratore</i> II (II.86–88, 351–360; II.74.299 on Themistocles); Pliny, <i>Natural History</i> VII.24 (VII.24.88–89)",
     "original": "Ciceron au i. des Tuſcula. nes, &amp; au ſecond de Oratore. Pline au liure vij. cha. xxiiij.",
     "gloss": "The stock roll of prodigious memories: Cyrus, who knew every soldier by name; L. Scipio, the Roman people; Cineas, the senate the day after his arrival; Mithridates, the twenty-two languages of his subjects; Metrodorus; Theodectes; Themistocles; Lucullus's memory is Cicero's, <i>Academica</i> II.1–2."
    },
    {
     "key": "b",
     "citation": "Coras, Annotation XII (cross-reference, as printed; the bearing is not evident — Annotation XII treats change of name and substitution of persons — and the print's numbering of headings is unreliable, Annotation XVIII being printed XIII)",
     "original": "ſoit veue l'an notat. xij.",
     "gloss": null
    }
   ]
  }
 ],
 "french": [
  {
   "type": "paragraph",
   "continues_prev": true,
   "continues_next": false,
   "lines": [
    "abordé: en ces deux pays & à chaque",
    "faict, deſigne particulierement certai-",
    "nes perſonnes, auec leſquelles on ſe",
    "peut informer, (comme depuis on a",
    "fait: & le tout verifié (pour rendre en-",
    "cor ce qu'il diſoit plus perſũaſible, &",
    "vray-ſemblable."
   ]
  },
  {
   "type": "heading",
   "text": "ANNOTAT. XXI.",
   "spaced_caps": true
  },
  {
   "type": "paragraph",
   "continues_prev": false,
   "continues_next": true,
   "lines": [
    "Ces propos ici longuement diſcourus, & la nume-",
    "roſité de tant & tant d'enſeignes ſi veritables, donnoiẽt",
    "grande occaſion au Iuges ſe perſuader l'innocence",
    "dudit du Tilh & en outre d'admirer l'heur, & la felicité",
    "de ſa memoire, qui auoit ſceu reciter innombrables",
    "choſes faictes, & paſſees plus de vingt ans y a: en quoy",
    "les commiſſaires, qui par tous moyens à eux poſſibles,",
    "taſchoyent de le ſurprendre en quelque menſonge, ne",
    "peurent toutesfois rien gagnier ſur luy, ni faire qu'il",
    "ne reſpondit veritablement à toutes choſes deſquelles",
    "neantmoins il eſtoit par eux ſeparement, & par inter-",
    "ualles interrogué. Ce que tiroit de plus en plus en ad-",
    "miration les iuges, qui pour la grande felicité d'vne ſi",
    "heureuſe memoire, l'euſſent volontiers parangonné à",
    "vn Scipion, Cyrus, Theodectes, Mithridates, Themi",
    "ſtocles, Cyneas, Metrodore, ou Lucule: perſonnes en",
    "l'heur de memoire excellente, & eternellement cele-",
    "brees {a} ſi l'iſſue miſerable de ce prodigieux affronteur",
    "n'euſt offencé l'eſplẽdeur de telles, & ſi bien marquées",
    "perſonnes en leur conferant vn ſi impudent, deploré, &",
    "malheureux homme {b}. Certes ſi ſans ſcrupule l'on pou",
    "uoit vſer de telles comparaiſons, elle ſeroit fort propre",
    "auec Portius Latro, grãd compaignon de Seneque, qui",
    "ſe vantoit n'auoir eſté iamais deceu de ſa memoire en",
    "vne ſeule parolle: & pour en faire l'eſſay, ſe faiſoit ſou",
    "uent propoſer le nom de quelque ancien capitaine, ou",
    "d'autre perſonne illuſtre & renommée, au plaiſir de ce-",
    "luy, qui le nommoit duquel ſur l'heure recitoit de fons",
    "en comble, la pure verité de tous les faicts depuis ſon"
   ]
  }
 ],
 "french_notes": [
  {
   "key": "a",
   "kind": "margin",
   "lines": [
    "Ciceron au",
    "i. des Tuſcula.",
    "nes, & au ſe-",
    "cond de Ora-",
    "tore. Pline au",
    "liure vij. cha.",
    "xxiiij."
   ]
  },
  {
   "key": "b",
   "kind": "margin",
   "lines": [
    "ſoit veue l'an",
    "notat. xij."
   ]
  }
 ],
 "uncertain": [
  {
   "where": "running_head",
   "text": "PARLEMINT DE THOLOSE.",
   "note": "sic, printer's error: the sort between M and N is a narrow capital I with symmetric serifs, not the three-armed E of PARLE and DE (both readers); kept as printed"
  },
  {
   "where": "blocks[0].lines[5]",
   "text": "cor ce qu'il diſoit plus perſũaſible, &",
   "note": "at 4x (pages/strips/p039/body-2.jpg, line 5) a clean short straight bar is printed centrally over the u of 'perſuaſible', the same straight nasal-bar sort as over the e of 'eſplẽdeur' (blocks[2].lines[18]) and the a of 'grãd' (lines[22]); it makes no sense in this word, so it is a compositor's error, transcribed as printed (ũ). Reader A took it for foul type"
  },
  {
   "where": "blocks[2].lines[1]",
   "text": "roſité de tant & tant d'enſeignes ſi veritables, donnoiẽt",
   "note": "the accent on 'roſité' is a small partly inked tick, read as the acute the fount uses elsewhere; grave cannot be excluded. The mark over the e of 'donnoiẽt' is wavy (tilde)"
  },
  {
   "where": "blocks[2].lines[2]",
   "text": "grande occaſion au Iuges ſe perſuader l'innocence",
   "note": "sic: 'au Iuges' where the sense wants 'aux Iuges'; no trace of an x"
  },
  {
   "where": "blocks[2].lines[0]",
   "text": "Ces propos ici longuement diſcourus, & la nume-",
   "note": "the line-end sign after 'nume' is inked low and thick and can look like a point; compared with 'certai-', 'cele-' and 'ad-' it is the same short hyphen sort. Same at the end of lines[16] ('cele-')"
  },
  {
   "where": "blocks[2].lines[18]",
   "text": "n'euſt offencé l'eſplẽdeur de telles, & ſi bien marquées",
   "note": "sic: 'eſplẽdeur' (straight nasal bar over the e); transcribed as printed"
  },
  {
   "where": "blocks[2].lines[27]",
   "text": "luy, qui le nommoit duquel ſur l'heure recitoit de fons",
   "note": "sic: 'de fons en comble'; transcribed as printed"
  },
  {
   "where": "margin_notes[0].lines[1]",
   "text": "i. des Tuſcula.",
   "note": "at 4x (pages/strips/p039/margin-3.jpg, note a line 2) the sign at the line end is a small dot low on the body, the same sort as the points of 'i.', 'cha.' and 'xxiiij.'; it is not the margin fount's hyphen, which is a wider mid-height stroke ('ſe-', 'Ora-' just below). Transcribed as a point although the word runs on to 'nes' (cf. p018 'Pline au li.' + 'ure')"
  },
  {
   "where": "margin_notes[0].lines[5]",
   "text": "liure vij. cha.",
   "note": "the numeral uses the italic fount's single ij sort; transcribed 'vij' per house practice, likewise 'xxiiij.' and 'xij.'"
  },
  {
   "where": "margin_notes[1].lines[0]",
   "text": "ſoit veue l'an",
   "note": "the third letter of the word after 'ſoit' is worn and could be taken for n ('vene'); read 'veue' on sense (soit veue l'annotat. xij). The line runs on to 'notat.' with no hyphen"
  },
  {
   "where": "margin_notes",
   "text": "",
   "note": "placement: the margin block sits low on the page; note a's first line is printed level with 'ſtocles, Cyneas, ... perſonnes en' (blocks[2].lines[15]) while its marker is on lines[17]; note b follows directly under it, its first line beside lines[21] while its marker is on lines[20]. beside_line values are approximate to within a line"
  },
  {
   "where": "signature",
   "text": "C iiij",
   "note": "the signature letter is an unbarred C (not G); fits the gathering (C from f. 33)"
  }
 ],
 "readings": [
  {
   "where": "blocks[0].lines[5]",
   "target": "blocks[0].lines[5]",
   "spans": [
    [
     25,
     37
    ]
   ],
   "aligned": true,
   "a": "cor ce qu'il diſoit plus perſuaſible, &",
   "b": "cor ce qu'il diſoit plus perſũaſible, &",
   "text": "cor ce qu'il diſoit plus perſũaſible, &",
   "chose": "B",
   "by": "reconciler",
   "status": "decided",